{
  "schemaVersion": 1,
  "fixtureId": "v2-12-independent-security-perf-audit-karpathy-review",
  "envelopeKind": "karpathy-review",
  "producer": "peaks-fixture-capture-cli",
  "producerVersion": "2.14.0",
  "sourceOrigin": {
    "kind": "historical-artifact",
    "path": "C:/Users/smallMark/Desktop/peaks-cli/.peaks/_runtime/2026-06-27-session-83acf5/rd/karpathy-review.md",
    "changeId": "v2-12-independent-security-perf-audit",
    "sessionId": "2026-06-27-session-83acf5",
    "parentFixtureId": null,
    "variantCommand": null
  },
  "capturedAt": "2026-06-28T02:49:27.430Z",
  "sanitization": {
    "passed": true,
    "rulesApplied": [
      "cookie-redaction",
      "token-redaction",
      "sso-url-redaction",
      "personal-email-redaction",
      "username-path-segment-redaction"
    ],
    "issues": []
  },
  "checksum": {
    "algorithm": "sha256",
    "value": "24cbe80f22a03be74bb40747a3249e86aef0283d1f01a4e7f298dd8524f91a54"
  },
  "edgeCases": [
    "historical-canonical"
  ]
}
