{
  "schemaVersion": 1,
  "fixtureId": "v2-12-independent-security-perf-audit-karpathy-review--chinese-colon",
  "envelopeKind": "karpathy-review",
  "producer": "peaks-fixture-capture-cli",
  "producerVersion": "2.14.0",
  "sourceOrigin": {
    "kind": "derived-variant",
    "path": "C:/Users/smallMark/Desktop/peaks-cli/tests/fixtures/replay/v2-12-independent-security-perf-audit-karpathy-review.md",
    "changeId": "v2-12-independent-security-perf-audit",
    "sessionId": "2026-06-27-session-83acf5",
    "parentFixtureId": "v2-12-independent-security-perf-audit-karpathy-review",
    "variantCommand": "chinese-colon"
  },
  "capturedAt": "2026-06-28T02:49:32.925Z",
  "sanitization": {
    "passed": true,
    "rulesApplied": [
      "cookie-redaction",
      "token-redaction",
      "sso-url-redaction",
      "personal-email-redaction",
      "username-path-segment-redaction"
    ],
    "issues": []
  },
  "checksum": {
    "algorithm": "sha256",
    "value": "24cbe80f22a03be74bb40747a3249e86aef0283d1f01a4e7f298dd8524f91a54"
  },
  "edgeCases": [
    "chinese-colon"
  ]
}
