{
  "schemaVersion": 1,
  "fixtureId": "v2-12-independent-security-perf-audit-qa-report--yaml-frontmatter-variation",
  "envelopeKind": "qa-report",
  "producer": "peaks-fixture-capture-cli",
  "producerVersion": "2.14.0",
  "sourceOrigin": {
    "kind": "derived-variant",
    "path": "C:/Users/smallMark/Desktop/peaks-loop/tests/fixtures/replay/v2-12-independent-security-perf-audit-qa-report.md",
    "changeId": "v2-12-independent-security-perf-audit",
    "sessionId": "2026-06-27-session-83acf5",
    "parentFixtureId": "v2-12-independent-security-perf-audit-qa-report",
    "variantCommand": "yaml-frontmatter-variation"
  },
  "capturedAt": "2026-06-28T02:49:35.678Z",
  "sanitization": {
    "passed": true,
    "rulesApplied": [
      "cookie-redaction",
      "token-redaction",
      "sso-url-redaction",
      "personal-email-redaction",
      "username-path-segment-redaction"
    ],
    "issues": []
  },
  "checksum": {
    "algorithm": "sha256",
    "value": "d0ab70d9eced4a787b0260aa4b153431937b55164fe217612e07766a7413ab42"
  },
  "edgeCases": [
    "yaml-frontmatter-variation"
  ]
}
