{
  "schemaVersion": 1,
  "fixtureId": "v2-12-independent-security-perf-audit-audit-perf--multi-findings",
  "envelopeKind": "audit-perf",
  "producer": "peaks-fixture-capture-cli",
  "producerVersion": "2.14.0",
  "sourceOrigin": {
    "kind": "derived-variant",
    "path": "C:/Users/smallMark/Desktop/peaks-cli/tests/fixtures/replay/v2-12-independent-security-perf-audit-audit-perf.md",
    "changeId": "v2-12-independent-security-perf-audit",
    "sessionId": "2026-06-27-session-83acf5",
    "parentFixtureId": "v2-12-independent-security-perf-audit-audit-perf",
    "variantCommand": "multi-findings"
  },
  "capturedAt": "2026-06-28T02:49:32.538Z",
  "sanitization": {
    "passed": true,
    "rulesApplied": [
      "cookie-redaction",
      "token-redaction",
      "sso-url-redaction",
      "personal-email-redaction",
      "username-path-segment-redaction"
    ],
    "issues": []
  },
  "checksum": {
    "algorithm": "sha256",
    "value": "1d846e4ac796a53027df21959f8716479ac46e5f3971c73988a1d7ba53646336"
  },
  "edgeCases": [
    "multi-findings"
  ]
}
