{
  "schemaVersion": 1,
  "fixtureId": "v2-12-independent-security-perf-audit-audit-security--yaml-frontmatter-variation",
  "envelopeKind": "audit-security",
  "producer": "peaks-fixture-capture-cli",
  "producerVersion": "2.14.0",
  "sourceOrigin": {
    "kind": "derived-variant",
    "path": "C:/Users/smallMark/Desktop/peaks-cli/tests/fixtures/replay/v2-12-independent-security-perf-audit-audit-security.md",
    "changeId": "v2-12-independent-security-perf-audit",
    "sessionId": "2026-06-27-session-83acf5",
    "parentFixtureId": "v2-12-independent-security-perf-audit-audit-security",
    "variantCommand": "yaml-frontmatter-variation"
  },
  "capturedAt": "2026-06-28T02:49:29.380Z",
  "sanitization": {
    "passed": true,
    "rulesApplied": [
      "cookie-redaction",
      "token-redaction",
      "sso-url-redaction",
      "personal-email-redaction",
      "username-path-segment-redaction"
    ],
    "issues": []
  },
  "checksum": {
    "algorithm": "sha256",
    "value": "e96d6d7b827c61cdba5c0d1ad3e771dd2ecaedbf936c1e61faa3fb6e0d9ea8c3"
  },
  "edgeCases": [
    "yaml-frontmatter-variation"
  ]
}
