{
  "schemaVersion": 1,
  "fixtureId": "v2-12-independent-security-perf-audit-audit-security--chinese-colon",
  "envelopeKind": "audit-security",
  "producer": "peaks-fixture-capture-cli",
  "producerVersion": "2.14.0",
  "sourceOrigin": {
    "kind": "derived-variant",
    "path": "C:/Users/smallMark/Desktop/peaks-loop/tests/fixtures/replay/v2-12-independent-security-perf-audit-audit-security.md",
    "changeId": "v2-12-independent-security-perf-audit",
    "sessionId": "2026-06-27-session-83acf5",
    "parentFixtureId": "v2-12-independent-security-perf-audit-audit-security",
    "variantCommand": "chinese-colon"
  },
  "capturedAt": "2026-06-28T02:49:28.988Z",
  "sanitization": {
    "passed": true,
    "rulesApplied": [
      "cookie-redaction",
      "token-redaction",
      "sso-url-redaction",
      "personal-email-redaction",
      "username-path-segment-redaction"
    ],
    "issues": []
  },
  "checksum": {
    "algorithm": "sha256",
    "value": "982db7180322ac953c577ae41e04ff1c55fb1b760772cad9aefa3f7b84e96739"
  },
  "edgeCases": [
    "chinese-colon"
  ]
}
