{
  "schemaVersion": 1,
  "fixtureId": "v2-12-independent-security-perf-audit-qa-report",
  "envelopeKind": "qa-report",
  "producer": "peaks-fixture-capture-cli",
  "producerVersion": "2.14.0",
  "sourceOrigin": {
    "kind": "historical-artifact",
    "path": "C:/Users/smallMark/Desktop/peaks-loop/.peaks/_runtime/2026-06-27-session-83acf5/qa/test-reports/2026-06-27-verdict-aggregator.md",
    "changeId": "v2-12-independent-security-perf-audit",
    "sessionId": "2026-06-27-session-83acf5",
    "parentFixtureId": null,
    "variantCommand": null
  },
  "capturedAt": "2026-06-28T02:49:28.222Z",
  "sanitization": {
    "passed": true,
    "rulesApplied": [
      "cookie-redaction",
      "token-redaction",
      "sso-url-redaction",
      "personal-email-redaction",
      "username-path-segment-redaction"
    ],
    "issues": []
  },
  "checksum": {
    "algorithm": "sha256",
    "value": "27ffe168b4a0362ebd1ff4e2eb4da825454f3b976b9e9e76408b9850286749ed"
  },
  "edgeCases": [
    "historical-canonical"
  ]
}
