{
  "schemaVersion": 1,
  "fixtureId": "v2-12-independent-security-perf-audit-prd-handoff--double-format",
  "envelopeKind": "prd-handoff",
  "producer": "peaks-fixture-capture-cli",
  "producerVersion": "2.14.0",
  "sourceOrigin": {
    "kind": "derived-variant",
    "path": "C:/Users/smallMark/Desktop/peaks-cli/tests/fixtures/replay/v2-12-independent-security-perf-audit-prd-handoff.md",
    "changeId": "v2-12-independent-security-perf-audit",
    "sessionId": "2026-06-27-session-83acf5",
    "parentFixtureId": "v2-12-independent-security-perf-audit-prd-handoff",
    "variantCommand": "double-format"
  },
  "capturedAt": "2026-06-28T02:49:38.040Z",
  "sanitization": {
    "passed": true,
    "rulesApplied": [
      "cookie-redaction",
      "token-redaction",
      "sso-url-redaction",
      "personal-email-redaction",
      "username-path-segment-redaction"
    ],
    "issues": []
  },
  "checksum": {
    "algorithm": "sha256",
    "value": "d294f3843e287bea5143bfc5d2f41c5a4a5c030ce85476fe48cc1f1281ead50b"
  },
  "edgeCases": [
    "double-format"
  ]
}
