{
  "schemaVersion": 1,
  "fixtureId": "v2-12-independent-security-perf-audit-mut-report",
  "envelopeKind": "mut-report",
  "producer": "peaks-fixture-capture-cli",
  "producerVersion": "2.14.0",
  "sourceOrigin": {
    "kind": "historical-artifact",
    "path": "C:/Users/smallMark/Desktop/peaks-cli/.peaks/_runtime/2026-06-27-session-83acf5/dogfood-v2132/mut/mut-report.json",
    "changeId": "v2-12-independent-security-perf-audit",
    "sessionId": "2026-06-27-session-83acf5",
    "parentFixtureId": null,
    "variantCommand": null
  },
  "capturedAt": "2026-06-28T02:49:27.815Z",
  "sanitization": {
    "passed": true,
    "rulesApplied": [
      "cookie-redaction",
      "token-redaction",
      "sso-url-redaction",
      "personal-email-redaction",
      "username-path-segment-redaction"
    ],
    "issues": []
  },
  "checksum": {
    "algorithm": "sha256",
    "value": "6c6b5cde34972b3ad06e38f3d2ba7d0b28181c3cc1f621283fb2b0935e061588"
  },
  "edgeCases": [
    "historical-canonical"
  ]
}
