{
  "schemaVersion": 1,
  "fixtureId": "v2-12-independent-security-perf-audit-karpathy-review--yaml-frontmatter-variatio",
  "envelopeKind": "karpathy-review",
  "producer": "peaks-fixture-capture-cli",
  "producerVersion": "2.14.0",
  "sourceOrigin": {
    "kind": "derived-variant",
    "path": "C:/Users/smallMark/Desktop/peaks-cli/tests/fixtures/replay/v2-12-independent-security-perf-audit-karpathy-review.md",
    "changeId": "v2-12-independent-security-perf-audit",
    "sessionId": "2026-06-27-session-83acf5",
    "parentFixtureId": "v2-12-independent-security-perf-audit-karpathy-review",
    "variantCommand": "yaml-frontmatter-variation"
  },
  "capturedAt": "2026-06-28T02:49:33.309Z",
  "sanitization": {
    "passed": true,
    "rulesApplied": [
      "cookie-redaction",
      "token-redaction",
      "sso-url-redaction",
      "personal-email-redaction",
      "username-path-segment-redaction"
    ],
    "issues": []
  },
  "checksum": {
    "algorithm": "sha256",
    "value": "08034fc42f3dd94d696afd3c8039bc0f32593260e1713711c5ab424e02bfb8ac"
  },
  "edgeCases": [
    "yaml-frontmatter-variation"
  ]
}
