{
  "schemaVersion": 1,
  "fixtureId": "v2-12-independent-security-perf-audit-prd-handoff--empty-body",
  "envelopeKind": "prd-handoff",
  "producer": "peaks-fixture-capture-cli",
  "producerVersion": "2.14.0",
  "sourceOrigin": {
    "kind": "derived-variant",
    "path": "C:/Users/smallMark/Desktop/peaks-loop/tests/fixtures/replay/v2-12-independent-security-perf-audit-prd-handoff.md",
    "changeId": "v2-12-independent-security-perf-audit",
    "sessionId": "2026-06-27-session-83acf5",
    "parentFixtureId": "v2-12-independent-security-perf-audit-prd-handoff",
    "variantCommand": "empty-body"
  },
  "capturedAt": "2026-06-28T02:49:38.442Z",
  "sanitization": {
    "passed": true,
    "rulesApplied": [
      "cookie-redaction",
      "token-redaction",
      "sso-url-redaction",
      "personal-email-redaction",
      "username-path-segment-redaction"
    ],
    "issues": []
  },
  "checksum": {
    "algorithm": "sha256",
    "value": "34f475abb6d634fd5eae21fd7c0720de153a8ad9871bebc9ebfedd7c3fd3843f"
  },
  "edgeCases": [
    "empty-body"
  ]
}
