{
  "schemaVersion": 1,
  "fixtureId": "v2-12-independent-security-perf-audit-audit-security",
  "envelopeKind": "audit-security",
  "producer": "peaks-fixture-capture-cli",
  "producerVersion": "2.14.0",
  "sourceOrigin": {
    "kind": "historical-artifact",
    "path": "C:/Users/smallMark/Desktop/peaks-loop/.peaks/_runtime/2026-06-27-session-83acf5/audit/security.md",
    "changeId": "v2-12-independent-security-perf-audit",
    "sessionId": "2026-06-27-session-83acf5",
    "parentFixtureId": null,
    "variantCommand": null
  },
  "capturedAt": "2026-06-28T02:49:26.629Z",
  "sanitization": {
    "passed": true,
    "rulesApplied": [
      "cookie-redaction",
      "token-redaction",
      "sso-url-redaction",
      "personal-email-redaction",
      "username-path-segment-redaction"
    ],
    "issues": []
  },
  "checksum": {
    "algorithm": "sha256",
    "value": "b0c2e24d3f93cd63dfc77e6abe7546f33a17c385642117354f0a35f8fd56cc38"
  },
  "edgeCases": [
    "historical-canonical"
  ]
}
