{
  "schemaVersion": 1,
  "fixtureId": "v2-12-independent-security-perf-audit-mut-report--double-format",
  "envelopeKind": "mut-report",
  "producer": "peaks-fixture-capture-cli",
  "producerVersion": "2.14.0",
  "sourceOrigin": {
    "kind": "derived-variant",
    "path": "C:/Users/smallMark/Desktop/peaks-loop/tests/fixtures/replay/v2-12-independent-security-perf-audit-mut-report.json",
    "changeId": "v2-12-independent-security-perf-audit",
    "sessionId": "2026-06-27-session-83acf5",
    "parentFixtureId": "v2-12-independent-security-perf-audit-mut-report",
    "variantCommand": "double-format"
  },
  "capturedAt": "2026-06-28T02:49:34.884Z",
  "sanitization": {
    "passed": true,
    "rulesApplied": [
      "cookie-redaction",
      "token-redaction",
      "sso-url-redaction",
      "personal-email-redaction",
      "username-path-segment-redaction"
    ],
    "issues": []
  },
  "checksum": {
    "algorithm": "sha256",
    "value": "fefec0dc1c8825db0188ddb7b1d9ed8e8504ca74d1b656bf3708385707d16589"
  },
  "edgeCases": [
    "double-format"
  ]
}
