{
  "schemaVersion": 1,
  "fixtureId": "v2-12-independent-security-perf-audit-qa-report--double-format",
  "envelopeKind": "qa-report",
  "producer": "peaks-fixture-capture-cli",
  "producerVersion": "2.14.0",
  "sourceOrigin": {
    "kind": "derived-variant",
    "path": "C:/Users/smallMark/Desktop/peaks-loop/tests/fixtures/replay/v2-12-independent-security-perf-audit-qa-report.md",
    "changeId": "v2-12-independent-security-perf-audit",
    "sessionId": "2026-06-27-session-83acf5",
    "parentFixtureId": "v2-12-independent-security-perf-audit-qa-report",
    "variantCommand": "double-format"
  },
  "capturedAt": "2026-06-28T02:49:36.088Z",
  "sanitization": {
    "passed": true,
    "rulesApplied": [
      "cookie-redaction",
      "token-redaction",
      "sso-url-redaction",
      "personal-email-redaction",
      "username-path-segment-redaction"
    ],
    "issues": []
  },
  "checksum": {
    "algorithm": "sha256",
    "value": "02486deaf98ffb24cfc46113b3a9ff063464aff22ce63c79066c0df20d17b1f9"
  },
  "edgeCases": [
    "double-format"
  ]
}
