{
  "schemaVersion": 1,
  "fixtureId": "v2-12-independent-security-perf-audit-prd-handoff--yaml-frontmatter-variation",
  "envelopeKind": "prd-handoff",
  "producer": "peaks-fixture-capture-cli",
  "producerVersion": "2.14.0",
  "sourceOrigin": {
    "kind": "derived-variant",
    "path": "C:/Users/smallMark/Desktop/peaks-loop/tests/fixtures/replay/v2-12-independent-security-perf-audit-prd-handoff.md",
    "changeId": "v2-12-independent-security-perf-audit",
    "sessionId": "2026-06-27-session-83acf5",
    "parentFixtureId": "v2-12-independent-security-perf-audit-prd-handoff",
    "variantCommand": "yaml-frontmatter-variation"
  },
  "capturedAt": "2026-06-28T02:49:37.651Z",
  "sanitization": {
    "passed": true,
    "rulesApplied": [
      "cookie-redaction",
      "token-redaction",
      "sso-url-redaction",
      "personal-email-redaction",
      "username-path-segment-redaction"
    ],
    "issues": []
  },
  "checksum": {
    "algorithm": "sha256",
    "value": "62edd2b08e3a5e95d85a785fa00827a1f071d3a86ae4260e9cf758229781e573"
  },
  "edgeCases": [
    "yaml-frontmatter-variation"
  ]
}
